"Dấu thời gian","Tên bạn là gì?","1. Bạn có thấy ít quan tâm, hứng thú khi học tập không?","2. Bạn có cảm thấy chán nản kiệt sức, hay tuyệt vọng không?","3. Bạn có khó ngủ, ngủ không lâu hoặc ngủ quá nhiều không?","4. Bạn có cảm thấy mệt mỏi hoặc thiếu năng lượng không?","5. Bạn có chán ăn hoặc ăn quá nhiều không?","6. Bạn có cảm thấy bản thân tồi tệ, cho rằng mình là người thất bại hoặc thất vọng về bản thân và gia đình không?","7. Bạn có khó tập trung vào một việc gì đó, ví dụ như nghe giảng hay đọc sách không?","8. Bạn đã từng di chuyển hoặc nói chậm đến mức người khác có thể nhận thấy không? Hay bạn có cảm thấy dễ lo lắng hoặc bồn chồn, lúc đó di chuyển nhiều hơn so với bình thường?","9. Bạn có nghĩ rằng mình chết đi sẽ tốt hơn, hoặc làm đau hay tổn thương cơ thể không?","1. Bạn có thấy ít quan tâm, hứng thú khi học tập không?","2. Bạn có cảm thấy chán nản kiệt sức, hay tuyệt vọng không?","3. Bạn có khó ngủ, ngủ không lâu hoặc ngủ quá nhiều không?","4. Bạn có cảm thấy mệt mỏi hoặc thiếu năng lượng không?","5. Bạn có chán ăn hoặc ăn quá nhiều không?","6. Bạn có cảm thấy bản thân tồi tệ, cho rằng mình là người thất bại hoặc thất vọng về bản thân và gia đình không?","7. Bạn có khó tập trung vào một việc gì đó, ví dụ như nghe giảng hay đọc sách không?","8. Bạn đã từng di chuyển hoặc nói chậm đến mức người khác có thể nhận thấy không? Hay bạn có cảm thấy dễ lo lắng hoặc bồn chồn, lúc đó di chuyển nhiều hơn so với bình thường?","9. Bạn có nghĩ rằng mình chết đi sẽ tốt hơn, hoặc làm đau hay tổn thương cơ thể không?"
"2024/04/08 11:11:06 CH GMT+7","Vũ Quang Vinh","2. Hơn một nửa số thời gian","2. Hơn một nửa số thời gian","1. Một vài ngày","1. Một vài ngày","1. Một vài ngày","2. Hơn một nửa số thời gian","3. Gần như mỗi ngày","0. Hầu như không","1. Một vài ngày","đôi khi ","trong một ngày sẽ có một vài khoảnh khác cảm thấy chán nản hoặc kiệt sức","có những ngày khó ngủ, một vài ngày ngủ không sâu hoặc bị ngắt quãng","thường sẽ cảm thấy thiếu năng lượng nếu một ngày có quá nhiều sự kiện diễn ra hoặc sẽ cảm thấy thiếu năng lượng vào những buổi tối cuối tuần","mức độ ăn bình thường","cảm thấy một chút thất bại so với những người cũng lứa","tùy vào từng thời điểm khác nhau, nhưng thường sẽ hơi khó để có thể tập trung","cảm thấy bình thường về vấn đề di chuyển hoặc nói","những thứ này thường xảy ra khi rơi vào những thời điểm tuyệt vọng, mọi tồi tệ thứ xảy ra cũng một lúc"
"2024/04/08 11:11:37 CH GMT+7","Hà Gia Bảo ","1. Một vài ngày","0. Hầu như không","2. Hơn một nửa số thời gian","0. Hầu như không","1. Một vài ngày","0. Hầu như không","2. Hơn một nửa số thời gian","3. Gần như mỗi ngày","0. Hầu như không","Một vài ngày khá là hứng thú so với việc học nhưng đôi khi lại không ","Luôn tự tin, chán nản là từ không bao giờ nằm trong đầu ","Đôi khi suy nghĩ nhiều nên khó ngủ hơn so với bình thường và cũng ngủ rất nhiều so với các ngày còn lại","Không bao giờ cảm thấy mệt mỏi hay thiếu năng lượng ","Muốn ăn nhiều nhưng đôi lúc cơ thể chán ăn","Không bao giờ, hầu như luôn luôn biết ơn vì những thứ hiện tại mình đang có.","Không phải là một người thích sự tập trung mà thích được hoạt động về tay chân nhiều hơn là chỉ nghe hoặc ngồi đọc sách","Đã từng bị cảm thấy lo lắng và di chuyển nhiều hơn ","Không bao giờ nghĩ tới dù chỉ là một lần."
"2024/04/08 11:15:45 CH GMT+7","Anh Tú","1. Một vài ngày","1. Một vài ngày","1. Một vài ngày","1. Một vài ngày","1. Một vài ngày","1. Một vài ngày","1. Một vài ngày","0. Hầu như không","0. Hầu như không","Vài lần có","Vài lần có","Có","Có","Có","Có","Có","Ko","Ko"
"2024/04/08 11:16:27 CH GMT+7","bùi hà my","3. Gần như mỗi ngày","1. Một vài ngày","2. Hơn một nửa số thời gian","2. Hơn một nửa số thời gian","1. Một vài ngày","3. Gần như mỗi ngày","0. Hầu như không","2. Hơn một nửa số thời gian","0. Hầu như không","không ","một nửa số thời gian","ngủ không được lâu khó ngủ","có thi thoảng thấy mệt mỏi","một vài ngày","có một chút nma vù thế mà k đc bỏ cuộc","hầu như không","nửa số thời gian","hầu như không"
"2024/04/08 11:20:52 CH GMT+7","Nguyễn Thanh Trúc","1. Một vài ngày","1. Một vài ngày","1. Một vài ngày","1. Một vài ngày","0. Hầu như không","1. Một vài ngày","1. Một vài ngày","0. Hầu như không","0. Hầu như không","Đôi khi, có thể do thiếu động lực học tập","Khi khối lượng công việc, bài học quá nhiều mình cảm thấy bị kiệt sức vì không biết bắt đầu từ đâu","Một vài ngày mình học bài tới sáng nếu hôm sau không đi học thì mình ngủ hơn nửa ngày.","Một vài ngày như là những ngày thiếu ngủ, những ngày chạy deadline bù đầu","Không có","Đôi khi","Đôi khi, có thể do môi trường xung quanh làm mình xao nhãng","Không có","Không có"
"2024/04/08 11:36:42 CH GMT+7","Võ Hoàng","1. Một vài ngày","1. Một vài ngày","1. Một vài ngày","1. Một vài ngày","1. Một vài ngày","1. Một vài ngày","0. Hầu như không","0. Hầu như không","0. Hầu như không","Trừ một vài môn xã hội, tôi không thích học mấy. Còn lại thì oke","Đôi khi tôi chán nản khi ở một mình","Một vài ngày tôi thức khuya quá và không ngủ được. Còn tôi ngủ quá nhiều chỉ khi tôi vừa uống về ","Thường là vào cuối ngày","Không","Không","Có. Tiếng động lớn, nhạc có lời, người khác nói chuyện, và thông báo điện thoại thường làm tôi trường bị mất tập trung","Không","Không"
"2024/04/08 11:41:17 CH GMT+7","Linh","1. Một vài ngày","1. Một vài ngày","1. Một vài ngày","2. Hơn một nửa số thời gian","2. Hơn một nửa số thời gian","1. Một vài ngày","1. Một vài ngày","2. Hơn một nửa số thời gian","1. Một vài ngày","Đôi khi","Nhiều lúc có","Có","Đôi khi","Đôi khi","Đôi khi","Có","Có","Ít khi"
"2024/04/08 11:54:56 CH GMT+7","An","1. Một vài ngày","1. Một vài ngày","1. Một vài ngày","1. Một vài ngày","1. Một vài ngày","1. Một vài ngày","1. Một vài ngày","0. Hầu như không","1. Một vài ngày","Đôi khi","Đôi khi","Đôi khi","Có, gần phân nửa thời gian","Đôi khi","Đôi khi","Đôi khi","Không","Đôi khi"